### ISSUE TITLE
ansible_ssh_common_args ignored in 2.14.0.dev0 (and 2.12, 2.13)

### ISSUE THREAD

**Issue by cwiech** [ansible/ansible#78750]
### Summary

Setting the ansible ProxyCommand in the playbook does not work. This issue was reported, and closed but the same issue still seems to persist in  the 2.14.0.dev0 branch on github. It appears the problem still exists in the 2.14 code and hasn't been resolved yet.

https://github.com/ansible-collections/ansible.netcommon/issues/296

### Issue Type

Bug Report

### Component Name

ansible.netcommon.network_cli

### Ansible Version

```console
$ ansible --version

(ansible-env2) vagrant@ansibletesting:~/git/ansible ansible --version
[WARNING]: You are running the development version of Ansible. You should only run Ansible from "devel" if you are
modifying the Ansible engine, or trying out features under development. This is a rapidly changing source of code and can
become unstable at any point.
ansible [core 2.14.0.dev0] (devel 79f67ed561) last updated 2022/09/12 14:17:50 (GMT +000)
  config file = /home/vagrant/git/ansible/ansible.cfg
  configured module search path = ['/home/vagrant/.ansible/plugins/modules', '/usr/share/ansible/plugins/modules']
  ansible python module location = /home/vagrant/ansible/lib/ansible
  ansible collection location = /home/vagrant/.ansible/collections:/usr/share/ansible/collections
  executable location = /home/vagrant/ansible/bin/ansible
  python version = 3.9.7 (default, Aug  2 2022, 15:22:45) [GCC 7.5.0] (/home/vagrant/ansible-env2/bin/python)
  jinja version = 3.1.2
  libyaml = True
```

### Configuration

```console
# if using a version older than ansible-core 2.12 you should omit the '-t all'
$ (ansible-env2) vagrant@ansibletesting:~/git/ansible ansible-config dump --only-changed -t all
[WARNING]: You are running the development version of Ansible. You should only run Ansible from "devel" if you are
modifying the Ansible engine, or trying out features under development. This is a rapidly changing source of code and can
become unstable at any point.
CONFIG_FILE() = /home/vagrant/git/ansible/ansible.cfg
DEFAULT_TIMEOUT(/home/vagrant/git/ansible/ansible.cfg) = 60
DISPLAY_SKIPPED_HOSTS(/home/vagrant/git/ansible/ansible.cfg) = False
HOST_KEY_CHECKING(/home/vagrant/git/ansible/ansible.cfg) = False
INTERPRETER_PYTHON(/home/vagrant/git/ansible/ansible.cfg) = /usr/bin/python3
PERSISTENT_COMMAND_TIMEOUT(/home/vagrant/git/ansible/ansible.cfg) = 300
PERSISTENT_CONNECT_TIMEOUT(/home/vagrant/git/ansible/ansible.cfg) = 320

CALLBACK:
========

default:
_______
display_skipped_hosts(/home/vagrant/git/ansible/ansible.cfg) = False

CONNECTION:
==========

paramiko_ssh:
____________
host_key_checking(/home/vagrant/git/ansible/ansible.cfg) = False

ssh:
___
host_key_checking(/home/vagrant/git/ansible/ansible.cfg) = False
timeout(/home/vagrant/git/ansible/ansible.cfg) = 60

SHELL:
=====

sh:
__
remote_tmp(/home/vagrant/git/ansible/ansible.cfg) = /tmp/.ansible-${USER}/tmp
```

### OS / Environment

Ubuntu 18.04

### Steps to Reproduce

As outlined in https://github.com/ansible-collections/ansible.netcommon/issues/296, any connection that tries to use the ansible_ssh_common_args doesn't work.

NOTE the workaround from the previous ticket (export ANSIBLE_PARAMIKO_PROXY_COMMAND) still works correctly, the ansible_ssh_common_args variable is still ignored.

```yaml (paste below)


TASK [debug vars ansible_ssh_common_args] **********************************************************************************
ok: [ear1.nso5] => {
    "msg": "-o ProxyCommand=\"ssh -W %h:%p -q proxyuser@proxyhost\""
}
```

### Expected Results

The ssh connection should use the proxy server, but it tries to establish the ssh connection directly.

### Actual Results

```console
TCP session is established directly to the 100.80.19.34 host ignoring the proxy setting.

root@ansibletesting1:~# tcpdump -i enp0s3 host 100.80.19.34
tcpdump: verbose output suppressed, use -v or -vv for full protocol decode
listening on enp0s3, link-type EN10MB (Ethernet), capture size 262144 bytes
14:49:56.726837 IP ansibletesting1.35244 > 100.80.19.34.ssh: Flags [S], seq 4222354873, win 64240, options [mss 1460,sackOK,TS val 480480513 ecr 0,nop,wscale 7], length 0
14:49:56.759725 IP 100.80.19.34.ssh > ansibletesting1.35244: Flags [S.], seq 2005448705, ack 4222354874, win 65535, options [mss 1460], length 0
14:49:56.759756 IP ansibletesting1.35244 > 100.80.19.34.ssh: Flags [.], ack 1, win 64240, length 0
14:49:56.760909 IP ansibletesting1.35244 > 100.80.19.34.ssh: Flags [P.], seq 1:26, ack 1, win 64240, length 25
```

### Code of Conduct

- [X] I agree to follow the Ansible Code of Conduct

**Comment by ansibot** [comment]
Files identified in the description:
* `lib/ansible/plugins/connection/network_cli.py`

If these files are incorrect, please update the `component name` section of the description or use the `!component` bot command.

[click here for bot help](https://github.com/ansible/ansibullbot/blob/devel/ISSUE_HELP.md)

**Comment by ansibot** [comment]
Thank you very much for your interest in Ansible. Ansible has migrated much of the content into separate repositories to allow for more rapid, independent development. We are closing this issue/PR because this content has been moved to one or more collection repositories.

* lib/ansible/plugins/connection/network_cli.py -> https://github.com/ansible-collections/ansible.netcommon (https://galaxy.ansible.com/ansible/netcommon)

For further information, please see:
https://github.com/ansible/ansibullbot/blob/devel/docs/collection_migration.md

**Comment by mkrizek** [comment]
!needs_collection_redirect

**Comment by sivel** [comment]
cc @Qalthos

**Comment by cwiech** [comment]
One more note. Using ansible-core 2.13.4 and ansible 6.3.0 with libssh installed, the workarounds with paramiko no longer work. It would seem the ability to proxy with libssh does not work. Just making sure that in the end  ansible_ssh_common_args will apply to libssh and paramiko connection types.

ansible               6.3.0
ansible-core          2.13.4
ansible-pylibssh      0.4.0

**Comment by bcoca** [comment]
that is something each plugin has to reference, not something core ansible does by itself

**Comment by sivel** [comment]
fwiw, it looks like for the `ansible.netcommon.libssh` connection plugin to work, would also require `ansible.netcommon` 3.1.1 or newer based on this commit https://github.com/ansible-collections/ansible.netcommon/commit/130c49ea32afea5807e2c733599a3e6a4da8baaa

`ansible==6.3.0` includes `ansible.netcommon==3.1.0`

I'm unsure of the extend of changes in that commit and how they impact the necessary config def merging, but just upgrading ansible-core alone isn't enough to resolve the issue.  It would also require updates to the plugins within the collection as well.

**Comment by sivel** [comment]
After spending several hours on this for a related issue, I can confirm that `2.14.0.dev0` and `ansible.netcommon==3.1.1` do indeed pass the variables to configure paramiko correctly.

However, the reason `ansible_ssh_common_args` doesn't work, is due to a slightly more complicated issue.

The `paramiko` connection plugin doesn't declare `ansible_ssh_common_args` as a valid configuration variable.  As such, it's no longer accessible to the paramiko plugin.

If you want to set the proxy host for use with paramiko, you currently need to utilize `proxy_command` which right now can only be set via env var or ansible.cfg, and not via a variable.

At a minimum, we should add a var for `proxy_command`.  I'm not sure that we should allow `paramiko` to accept `ansible_ssh_common_args` because it only did so in the past to attempt to parse out `ProxyCommand`.  And since there is an explicit `proxy_command` config, adding `ssh_args`, `ssh_common_args`, and `ssh_extra_args` doesn't seem like a good idea.

It worked in the past, because we stuffed a lot on the `PlayContext` object, and we could just pop it off.  But that no longer works.

**Comment by cwiech** [comment]
Thanks for digging into this. The challenge (and this was raised in the original ticket), configuring a proxy in ansibe.cfg limits you to a single device for the entire playbook/role. Similarly, defining a environment variable requires you somehow know the inventory before hand, and won't allow you to have any kind of mixed inventory that will live behind different bubbles. 

In a complex network with many different management networks or devices behind different proxies, this doesn't scale. Being able to set the required proxy per host, inside the play (based on whatever logic is needed while it runs) would be very important and mandatory for any type of complex automation that will span multiple  different management domains. Perhaps there is a different way to do this per host while the playbook is running that I have missed? This has worked for years and is a mandatory feature to work on a network of any scale. Can this feature be added back? Will moving to libssh work, if paramiko can't be fixed?

**Comment by sivel** [comment]
The pull request listed above addresses this. It adds those ssh arg variables back, though listed as deprecated. It also adds a variable for the `proxy_command` config.

The deprecations and new `proxy_command` variable will be for 2.15, the other vars will be backported.
