### ISSUE TITLE
Junos Netconf doesn't work via Bastion

### ISSUE THREAD

**Issue by pffs** [ansible/ansible#37262]
##### ISSUE TYPE

 - Bug Report

##### COMPONENT NAME

- junos modules using netconf transport

##### ANSIBLE VERSION

```
ansible 2.4.3.0
  config file = /home/pffs/scripts/ansible-test/ansible.cfg
  configured module search path = [u'/home/pffs/.ansible/plugins/modules', u'/usr/share/ansible/plugins/modules']
  ansible python module location = /home/pffs/scripts/ansible-test/.venv-p2/lib/python2.7/site-packages/ansible
  executable location = /home/pffs/scripts/ansible-test/.venv-p2/bin/ansible
  python version = 2.7.14 (default, Oct 31 2017, 21:12:13) [GCC 6.4.0]
```

##### CONFIGURATION

```
DEFAULT_CALLBACK_WHITELIST(/home/pffs/scripts/ansible-test/ansible.cfg) = ['profile_tasks', 'timer']
DEFAULT_HOST_LIST(/home/pffs/scripts/ansible-test/ansible.cfg) = [u'/home/pffs/scripts/ansible-test/inventory']
DEFAULT_LOG_PATH(/home/pffs/scripts/ansible-test/ansible.cfg) = /home/pffs/scripts/ansible-test/log
HOST_KEY_CHECKING(/home/pffs/scripts/ansible-test/ansible.cfg) = False
PARAMIKO_PROXY_COMMAND(/home/pffs/scripts/ansible-test/ansible.cfg) = ssh -W "%h:%p" lab
PARAMIKO_RECORD_HOST_KEYS(/home/pffs/scripts/ansible-test/ansible.cfg) = False
```

##### OS / ENVIRONMENT

- Tested on Cygwin and Ubuntu 16.04

##### SUMMARY

When connecting via Bastion, network_cli works, but netconf does not. The same playbook when run from the bastion directly works as expected. Logs look like the netconf modules are ignoring the proxy arguments.

##### STEPS TO REPRODUCE

Set up bastion in ansible.cfg, attempt to run any junos module requiring netconf

```yaml
---
- hosts: all
  gather_facts: no
  connection: local
  vars_files:
    - secrets.yaml

  tasks:
    - name: ENABLE NETCONF
      junos_netconf:
        netconf_port: 22
        provider: "{{ junos_provider }}"
        state: present

    - name: INFO
      junos_facts:
        provider: "{{ junos_provider }}"
```

##### EXPECTED RESULTS

Enabled netconf on device, get information from device

##### ACTUAL RESULTS

Netconf enablement works, fails on info

```
ansible-playbook 2.4.3.0
  config file = /home/pffs/scripts/ansible-test/ansible.cfg
  configured module search path = [u'/home/pffs/.ansible/plugins/modules', u'/usr/share/ansible/plugins/modules']
  ansible python module location = /home/pffs/scripts/ansible-test/.venv-p2/lib/python2.7/site-packages/ansible
  executable location = /home/pffs/scripts/ansible-test/.venv-p2/bin/ansible-playbook
  python version = 2.7.14 (default, Oct 31 2017, 21:12:13) [GCC 6.4.0]
Using /home/pffs/scripts/ansible-test/ansible.cfg as config file
Parsed /home/pffs/scripts/ansible-test/inventory inventory source with ini plugin

PLAYBOOK: testbook.yaml *************************************************************************************************************************************************************************************************************************************************
1 plays in testbook.yaml
Read vars_file 'secrets.yaml'
Read vars_file 'secrets.yaml'

PLAY [all] **************************************************************************************************************************************************************************************************************************************************************
META: ran handlers
Read vars_file 'secrets.yaml'

TASK [ENABLE NETCONF] ***************************************************************************************************************************************************************************************************************************************************
task path: /home/pffs/scripts/ansible-test/testbook.yaml:9
Friday 09 March 2018  11:53:36 -0500 (0:00:00.374)       0:00:00.374 **********
<192.168.100.104> using connection plugin network_cli
Using module file /home/pffs/scripts/ansible-test/.venv-p2/lib/python2.7/site-packages/ansible/modules/network/junos/junos_netconf.py
<192.168.100.104> ESTABLISH LOCAL CONNECTION FOR USER: pffs
<192.168.100.104> EXEC /bin/sh -c 'echo ~ && sleep 0'
<192.168.100.104> EXEC /bin/sh -c '( umask 77 && mkdir -p "` echo /home/pffs/.ansible/tmp/ansible-tmp-1520614426.71-207001351097560 `" && echo ansible-tmp-1520614426.71-207001351097560="` echo /home/pffs/.ansible/tmp/ansible-tmp-1520614426.71-207001351097560 `"
 ) && sleep 0'
<192.168.100.104> PUT /cygdrive/c/Users/pffs/AppData/Local/Temp/tmpEJaRbd TO /home/pffs/.ansible/tmp/ansible-tmp-1520614426.71-207001351097560/junos_netconf.py
<192.168.100.104> EXEC /bin/sh -c 'chmod u+x /home/pffs/.ansible/tmp/ansible-tmp-1520614426.71-207001351097560/ /home/pffs/.ansible/tmp/ansible-tmp-1520614426.71-207001351097560/junos_netconf.py && sleep 0'
<192.168.100.104> EXEC /bin/sh -c '/usr/bin/python /home/pffs/.ansible/tmp/ansible-tmp-1520614426.71-207001351097560/junos_netconf.py; rm -rf "/home/pffs/.ansible/tmp/ansible-tmp-1520614426.71-207001351097560/" > /dev/null 2>&1 && sleep 0'
ok: [srx] => {
    "changed": false,
    "commands": [],
    "invocation": {
        "module_args": {
            "host": null,
            "netconf_port": 22,
            "password": null,
            "port": null,
            "provider": {
                "host": null,
                "password": "VALUE_SPECIFIED_IN_NO_LOG_PARAMETER",
                "port": 22,
                "ssh_keyfile": null,
                "timeout": null,
                "transport": null,
                "username": "juniper"
            },
            "ssh_keyfile": null,
            "state": "present",
            "timeout": null,
            "transport": null,
            "username": null
        }
    }
}
Read vars_file 'secrets.yaml'

TASK [INFO] *************************************************************************************************************************************************************************************************************************************************************
task path: /home/pffs/scripts/ansible-test/testbook.yaml:15
Friday 09 March 2018  11:53:50 -0500 (0:00:13.683)       0:00:14.058 **********
<192.168.100.104> using connection plugin netconf
fatal: [srx]: FAILED! => {
    "changed": false,
    "msg": "unable to open shell. Please see: https://docs.ansible.com/ansible/network_debug_troubleshooting.html#unable-to-open-shell"
}
        to retry, use: --limit @/home/pffs/scripts/ansible-test/testbook.retry

PLAY RECAP **************************************************************************************************************************************************************************************************************************************************************
srx                        : ok=1    changed=0    unreachable=0    failed=1


Friday 09 March 2018  11:54:03 -0500 (0:00:13.520)       0:00:27.578 **********
===============================================================================
ENABLE NETCONF -------------------------------------------------------------------------------------------------------------------------------------------------------------------------------------------------------------------------------------------------- 13.68s
/home/pffs/scripts/ansible-test/testbook.yaml:9 ----------------------------------------------------------------------------------------------------------------------------------------------------------------------------------------------------------------------
INFO ------------------------------------------------------------------------------------------------------------------------------------------------------------------------------------------------------------------------------------------------------------ 13.52s
/home/pffs/scripts/ansible-test/testbook.yaml:15 ---------------------------------------------------------------------------------------------------------------------------------------------------------------------------------------------------------------------
Playbook run took 0 days, 0 hours, 0 minutes, 27 seconds
```
In the logs it appears to be trying to connect directly to the host:

```
2018-03-09 11:53:50,215 p=23960 u=pffs |  TASK [INFO] *************************************************************************************************************************************************************************************************************************************************************
2018-03-09 11:53:50,215 p=23960 u=pffs |  task path: /home/pffs/scripts/ansible-test/testbook.yaml:15
2018-03-09 11:53:50,215 p=23960 u=pffs |  Friday 09 March 2018  11:53:50 -0500 (0:00:13.683)       0:00:14.058 **********
2018-03-09 11:53:53,478 p=20104 u=pffs |  creating new control socket for host 192.168.100.104:22 as user juniper
2018-03-09 11:53:53,478 p=20104 u=pffs |  control socket path is /home/pffs/.ansible/pc/663894f18e
2018-03-09 11:53:53,478 p=20104 u=pffs |  current working directory is /home/pffs/scripts/ansible-test
2018-03-09 11:53:53,478 p=20104 u=pffs |  using connection plugin netconf
2018-03-09 11:53:53,750 p=20104 u=pffs |  network_os is set to junos
2018-03-09 11:53:53,762 p=20104 u=pffs |  ssh connection done, stating ncclient
2018-03-09 11:54:03,779 p=20104 u=pffs |  failed to create control socket for host 192.168.100.104
2018-03-09 11:54:03,781 p=20104 u=pffs |  Traceback (most recent call last):
  File "/home/pffs/scripts/ansible-test/.venv-p2/bin/ansible-connection", line 315, in main
    server = Server(socket_path, pc)
  File "/home/pffs/scripts/ansible-test/.venv-p2/bin/ansible-connection", line 112, in __init__
    self.connection._connect()
  File "/home/pffs/scripts/ansible-test/.venv-p2/lib/python2.7/site-packages/ansible/plugins/connection/netconf.py", line 158, in _connect
    ssh_config=ssh_config
  File "/home/pffs/scripts/ansible-test/.venv-p2/lib/python2.7/site-packages/ncclient/manager.py", line 154, in connect
    return connect_ssh(*args, **kwds)
  File "/home/pffs/scripts/ansible-test/.venv-p2/lib/python2.7/site-packages/ncclient/manager.py", line 119, in connect_ssh
    session.connect(*args, **kwds)
  File "/home/pffs/scripts/ansible-test/.venv-p2/lib/python2.7/site-packages/ncclient/transport/ssh.py", line 383, in connect
    raise SSHError("Could not open socket to %s:%s" % (host, port))
SSHError: Could not open socket to 192.168.100.104:22
```
Running a tcpdump on the ansible node shows ssh packets destined directly for the host. Same capturing against the bastion shows no ssh packets from the bastion towards the host.

**Comment by ansibot** [comment]
Files identified in the description:
* [lib/ansible/modules/network/junos](https://github.com/ansible/ansible/blob/devel/lib/ansible/modules/network/junos)

If these files are inaccurate, please update the `component name` section of the description or use the `!component` bot command.

[click here for bot help](https://github.com/ansible/ansibullbot/blob/master/ISSUE_HELP.md)

**Comment by ansibot** [comment]
cc @Qalthos @ganeshrn
[click here for bot help](https://github.com/ansible/ansibullbot/blob/master/ISSUE_HELP.md)

**Comment by gundalow** [comment]
Could you please test on 2.5.0rc2?

**Comment by gundalow** [comment]
pffs has informed me this is still broken on 2.5.0rc2

I think this is something that needs fixing for 2.5.1, adding to project board

**Comment by gundalow** [comment]
Can you please remove `provider:` and test with `connection: netconf`
See http://docs.ansible.com/ansible/devel/network/user_guide/platform_junos.html for details

**Comment by pffs** [comment]
Tested on 2.5.0rc2, looks the same:

```
ansible 2.5.0rc2
  config file = /home/pffs/scripts/ansible-test/ansible.cfg
  configured module search path = [u'/home/pffs/.ansible/plugins/modules', u'/usr/share/ansible/plugins/modules']
  ansible python module location = /home/pffs/scripts/ansible-test/.venv-p2/lib/python2.7/site-packages/ansible
  executable location = /home/pffs/scripts/ansible-test/.venv-p2/bin/ansible
  python version = 2.7.14 (default, Oct 31 2017, 21:12:13) [GCC 6.4.0]
```

```
2018-03-09 12:50:07,466 p=26160 u=pffs |  TASK [INFO] *****************************************************************************************************************************************************************************************************************
********************************************
2018-03-09 12:50:07,466 p=26160 u=pffs |  task path: /home/pffs/scripts/ansible-test/testbook.yaml:15
2018-03-09 12:50:07,466 p=26160 u=pffs |  Friday 09 March 2018  12:50:07 -0500 (0:00:11.017)       0:00:11.538 **********
2018-03-09 12:50:11,654 p=3360 u=pffs |  network_os is set to junos
2018-03-09 12:50:11,724 p=3360 u=pffs |  ssh connection done, starting ncclient
2018-03-09 12:50:21,748 p=3360 u=pffs |  shutdown complete
2018-03-09 12:50:21,837 p=26160 u=pffs |  The full traceback is:
Traceback (most recent call last):
  File "/home/pffs/scripts/ansible-test/.venv-p2/bin/ansible-connection", line 70, in start
    self.connection._connect()
  File "/home/pffs/scripts/ansible-test/.venv-p2/lib/python2.7/site-packages/ansible/plugins/connection/netconf.py", line 265, in _connect
    ssh_config=ssh_config
  File "/home/pffs/scripts/ansible-test/.venv-p2/lib/python2.7/site-packages/ncclient/manager.py", line 154, in connect
    return connect_ssh(*args, **kwds)
  File "/home/pffs/scripts/ansible-test/.venv-p2/lib/python2.7/site-packages/ncclient/manager.py", line 119, in connect_ssh
    session.connect(*args, **kwds)
  File "/home/pffs/scripts/ansible-test/.venv-p2/lib/python2.7/site-packages/ncclient/transport/ssh.py", line 383, in connect
    raise SSHError("Could not open socket to %s:%s" % (host, port))
SSHError: Could not open socket to 192.168.100.104:22

2018-03-09 12:50:21,853 p=26160 u=pffs |  fatal: [srx]: FAILED! => {
    "msg": "Could not open socket to 192.168.100.104:22"
}
2018-03-09 12:50:21,857 paramiko.transport [chan 0] EOF sent (0)
2018-03-09 12:50:21,859 p=26132 u=pffs |  shutdown complete
2018-03-09 12:50:21,862 p=26160 u=pffs |      to retry, use: --limit @/home/pffs/scripts/ansible-test/testbook.retry

2018-03-09 12:50:21,862 p=26160 u=pffs |  PLAY RECAP **************************************************************************************************************************************************************************************************************************************************************
2018-03-09 12:50:21,862 p=26160 u=pffs |  srx                        : ok=1    changed=0    unreachable=0    failed=1
2018-03-09 12:50:21,863 p=26160 u=pffs |  Friday 09 March 2018  12:50:21 -0500 (0:00:14.396)       0:00:25.935 **********
2018-03-09 12:50:21,863 p=26160 u=pffs |  ===============================================================================
2018-03-09 12:50:21,863 p=26160 u=pffs |  INFO ------------------------------------------------------------------------------------------------------------------------------------------------------------------------------------------------------------------------------------------------------------ 14.40s
/home/pffs/scripts/ansible-test/testbook.yaml:15 ---------------------------------------------------------------------------------------------------------------------------------------------------------------------------------------------------------------------
2018-03-09 12:50:21,863 p=26160 u=pffs |  ENABLE NETCONF -------------------------------------------------------------------------------------------------------------------------------------------------------------------------------------------------------------------------------------------------- 11.02s
/home/pffs/scripts/ansible-test/testbook.yaml:9 ----------------------------------------------------------------------------------------------------------------------------------------------------------------------------------------------------------------------
2018-03-09 12:50:21,863 p=26160 u=pffs |  Playbook run took 0 days, 0 hours, 0 minutes, 25 seconds
2018-03-09 12:50:21,905 paramiko.transport EOF in transport thread
```

**Comment by pffs** [comment]
Testing with the new connection variables. Script looks like:
```yaml
---
- hosts: junos
  gather_facts: no

  tasks:
    - name: INFO
      junos_facts:
```
group_vars/junos.yaml
``` yaml
---
ansible_network_os: junos
ansible_connection: netconf
ansible_user: juniper
ansible_ssh_pass: <removed>
ansible_ssh_common_args: '-o ProxyCommand="ssh -W %h:%p -q lab"'
ansible_port: 22
```
inventory
```
[junos]
srx ansible_host=192.168.100.104
```
On the ansible node, tcpdump shows packets straight to the host:
```
tcpdump -nni ens160 host 192.168.100.104
tcpdump: verbose output suppressed, use -v or -vv for full protocol decode
listening on ens160, link-type EN10MB (Ethernet), capture size 262144 bytes
15:27:02.206476 IP 192.168.236.115.51896 > 192.168.100.104.22: Flags [S], seq 3441663918, win 29200, options [mss 1460,sackOK,TS val 2004686 ecr 0,nop,wscale 7], length 0
15:27:03.205342 IP 192.168.236.115.51896 > 192.168.100.104.22: Flags [S], seq 3441663918, win 29200, options [mss 1460,sackOK,TS val 2004936 ecr 0,nop,wscale 7], length 0
15:27:05.209399 IP 192.168.236.115.51896 > 192.168.100.104.22: Flags [S], seq 3441663918, win 29200, options [mss 1460,sackOK,TS val 2005437 ecr 0,nop,wscale 7], length 0
15:27:09.221410 IP 192.168.236.115.51896 > 192.168.100.104.22: Flags [S], seq 3441663918, win 29200, options [mss 1460,sackOK,TS val 2006440 ecr 0,nop,wscale 7], length 0
```
Play output with -vvv:
```
ansible-playbook 2.5.0rc2
  config file = /home/pffs/ansibletest/ansible.cfg
  configured module search path = [u'/home/pffs/.ansible/plugins/modules', u'/usr/share/ansible/plugins/modules']
  ansible python module location = /home/pffs/ansibletest/venv/local/lib/python2.7/site-packages/ansible
  executable location = /home/pffs/ansibletest/venv/bin/ansible-playbook
  python version = 2.7.12 (default, Dec  4 2017, 14:50:18) [GCC 5.4.0 20160609]
Using /home/pffs/ansibletest/ansible.cfg as config file
Parsed /home/pffs/ansibletest/inventory inventory source with ini plugin

PLAYBOOK: script.yaml ***************************************************************************************************************************************************************************************************************************************************
1 plays in script.yaml

PLAY [junos] ************************************************************************************************************************************************************************************************************************************************************
META: ran handlers

TASK [INFO] *************************************************************************************************************************************************************************************************************************************************************
task path: /home/pffs/ansibletest/script.yaml:6
The full traceback is:
Traceback (most recent call last):
  File "/home/pffs/ansibletest/venv/bin/ansible-connection", line 70, in start
    self.connection._connect()
  File "/home/pffs/ansibletest/venv/local/lib/python2.7/site-packages/ansible/plugins/connection/netconf.py", line 265, in _connect
    ssh_config=ssh_config
  File "/home/pffs/ansibletest/venv/local/lib/python2.7/site-packages/ncclient/manager.py", line 154, in connect
    return connect_ssh(*args, **kwds)
  File "/home/pffs/ansibletest/venv/local/lib/python2.7/site-packages/ncclient/manager.py", line 119, in connect_ssh
    session.connect(*args, **kwds)
  File "/home/pffs/ansibletest/venv/local/lib/python2.7/site-packages/ncclient/transport/ssh.py", line 383, in connect
    raise SSHError("Could not open socket to %s:%s" % (host, port))
SSHError: Could not open socket to 192.168.100.104:22

fatal: [srx]: FAILED! => {
    "msg": "Could not open socket to 192.168.100.104:22"
}
        to retry, use: --limit @/home/pffs/ansibletest/script.retry

PLAY RECAP **************************************************************************************************************************************************************************************************************************************************************
srx                        : ok=0    changed=0    unreachable=0    failed=1
```
and logs:
```
2018-03-09 15:27:00,444 p=27645 u=pffs |  ansible-playbook 2.5.0rc2
  config file = /home/pffs/ansibletest/ansible.cfg
  configured module search path = [u'/home/pffs/.ansible/plugins/modules', u'/usr/share/ansible/plugins/modules']
  ansible python module location = /home/pffs/ansibletest/venv/local/lib/python2.7/site-packages/ansible
  executable location = /home/pffs/ansibletest/venv/bin/ansible-playbook
  python version = 2.7.12 (default, Dec  4 2017, 14:50:18) [GCC 5.4.0 20160609]
2018-03-09 15:27:00,444 p=27645 u=pffs |  Using /home/pffs/ansibletest/ansible.cfg as config file
2018-03-09 15:27:00,491 p=27645 u=pffs |  Parsed /home/pffs/ansibletest/inventory inventory source with ini plugin
2018-03-09 15:27:00,896 p=27645 u=pffs |  PLAYBOOK: script.yaml ***************************************************************************************************************************************************************************************************************************************************
2018-03-09 15:27:00,897 p=27645 u=pffs |  1 plays in script.yaml
2018-03-09 15:27:00,911 p=27645 u=pffs |  PLAY [junos] ************************************************************************************************************************************************************************************************************************************************************
2018-03-09 15:27:00,917 p=27645 u=pffs |  META: ran handlers
2018-03-09 15:27:00,923 p=27645 u=pffs |  TASK [INFO] *************************************************************************************************************************************************************************************************************************************************************
2018-03-09 15:27:00,923 p=27645 u=pffs |  task path: /home/pffs/ansibletest/script.yaml:6
2018-03-09 15:27:01,050 p=27645 u=pffs |  network_os is set to junos
2018-03-09 15:27:02,112 p=27653 u=pffs |  network_os is set to junos
2018-03-09 15:27:02,204 p=27653 u=pffs |  ssh connection done, starting ncclient
2018-03-09 15:27:12,207 p=27653 u=pffs |  shutdown complete
2018-03-09 15:27:12,243 p=27645 u=pffs |  The full traceback is:
Traceback (most recent call last):
  File "/home/pffs/ansibletest/venv/bin/ansible-connection", line 70, in start
    self.connection._connect()
  File "/home/pffs/ansibletest/venv/local/lib/python2.7/site-packages/ansible/plugins/connection/netconf.py", line 265, in _connect
    ssh_config=ssh_config
  File "/home/pffs/ansibletest/venv/local/lib/python2.7/site-packages/ncclient/manager.py", line 154, in connect
    return connect_ssh(*args, **kwds)
  File "/home/pffs/ansibletest/venv/local/lib/python2.7/site-packages/ncclient/manager.py", line 119, in connect_ssh
    session.connect(*args, **kwds)
  File "/home/pffs/ansibletest/venv/local/lib/python2.7/site-packages/ncclient/transport/ssh.py", line 383, in connect
    raise SSHError("Could not open socket to %s:%s" % (host, port))
SSHError: Could not open socket to 192.168.100.104:22

2018-03-09 15:27:12,248 p=27645 u=pffs |  fatal: [srx]: FAILED! => {
    "msg": "Could not open socket to 192.168.100.104:22"
}
2018-03-09 15:27:12,250 p=27645 u=pffs |      to retry, use: --limit @/home/pffs/ansibletest/script.retry
```
Just to make sure the bastion bits works, I ran just the junos_netconf module with the ansible_connection set to network_cli instead, and worked just fine, so still seems to a netconf problem.  On a side note, having to modify the group_vars in order to swap between the two types of modules seems like a regression in functionality. Previously I could run a playbook that makes sure that netconf is turned on and then run the netconf modules, Now I need to modify my environment and have two sets of scripts in order to do so.

**Comment by gundalow** [comment]
@ganeshrn Do you believe this something we can get fixed in 2.5.1?

**Comment by ansibot** [comment]
Files identified in the description:
* [lib/ansible/modules/network/junos/__init__.py](https://github.com/ansible/ansible/blob/devel/lib/ansible/modules/network/junos/__init__.py)
* [lib/ansible/modules/network/junos/junos_banner.py](https://github.com/ansible/ansible/blob/devel/lib/ansible/modules/network/junos/junos_banner.py)
* [lib/ansible/modules/network/junos/junos_command.py](https://github.com/ansible/ansible/blob/devel/lib/ansible/modules/network/junos/junos_command.py)
* [lib/ansible/modules/network/junos/junos_config.py](https://github.com/ansible/ansible/blob/devel/lib/ansible/modules/network/junos/junos_config.py)
* [lib/ansible/modules/network/junos/junos_facts.py](https://github.com/ansible/ansible/blob/devel/lib/ansible/modules/network/junos/junos_facts.py)
* [lib/ansible/modules/network/junos/junos_interface.py](https://github.com/ansible/ansible/blob/devel/lib/ansible/modules/network/junos/junos_interface.py)
* [lib/ansible/modules/network/junos/junos_l2_interface.py](https://github.com/ansible/ansible/blob/devel/lib/ansible/modules/network/junos/junos_l2_interface.py)
* [lib/ansible/modules/network/junos/junos_l3_interface.py](https://github.com/ansible/ansible/blob/devel/lib/ansible/modules/network/junos/junos_l3_interface.py)
* [lib/ansible/modules/network/junos/junos_linkagg.py](https://github.com/ansible/ansible/blob/devel/lib/ansible/modules/network/junos/junos_linkagg.py)
* [lib/ansible/modules/network/junos/junos_lldp.py](https://github.com/ansible/ansible/blob/devel/lib/ansible/modules/network/junos/junos_lldp.py)
* [lib/ansible/modules/network/junos/junos_lldp_interface.py](https://github.com/ansible/ansible/blob/devel/lib/ansible/modules/network/junos/junos_lldp_interface.py)
* [lib/ansible/modules/network/junos/junos_logging.py](https://github.com/ansible/ansible/blob/devel/lib/ansible/modules/network/junos/junos_logging.py)
* [lib/ansible/modules/network/junos/junos_netconf.py](https://github.com/ansible/ansible/blob/devel/lib/ansible/modules/network/junos/junos_netconf.py)
* [lib/ansible/modules/network/junos/junos_package.py](https://github.com/ansible/ansible/blob/devel/lib/ansible/modules/network/junos/junos_package.py)
* [lib/ansible/modules/network/junos/junos_rpc.py](https://github.com/ansible/ansible/blob/devel/lib/ansible/modules/network/junos/junos_rpc.py)
* [lib/ansible/modules/network/junos/junos_scp.py](https://github.com/ansible/ansible/blob/devel/lib/ansible/modules/network/junos/junos_scp.py)
* [lib/ansible/modules/network/junos/junos_static_route.py](https://github.com/ansible/ansible/blob/devel/lib/ansible/modules/network/junos/junos_static_route.py)
* [lib/ansible/modules/network/junos/junos_system.py](https://github.com/ansible/ansible/blob/devel/lib/ansible/modules/network/junos/junos_system.py)
* [lib/ansible/modules/network/junos/junos_user.py](https://github.com/ansible/ansible/blob/devel/lib/ansible/modules/network/junos/junos_user.py)
* [lib/ansible/modules/network/junos/junos_vlan.py](https://github.com/ansible/ansible/blob/devel/lib/ansible/modules/network/junos/junos_vlan.py)
* [lib/ansible/modules/network/junos/junos_vrf.py](https://github.com/ansible/ansible/blob/devel/lib/ansible/modules/network/junos/junos_vrf.py)

If these files are inaccurate, please update the `component name` section of the description or use the `!component` bot command.

[click here for bot help](https://github.com/ansible/ansibullbot/blob/master/ISSUE_HELP.md)

**Comment by ansibot** [comment]
cc @GIC-de @privateip @qalthos
[click here for bot help](https://github.com/ansible/ansibullbot/blob/master/ISSUE_HELP.md)

**Comment by ansibot** [comment]
Files identified in the description:
* [lib/ansible/modules/network/junos](https://github.com/ansible/ansible/blob/devel/lib/ansible/modules/network/junos)

If these files are inaccurate, please update the `component name` section of the description or use the `!component` bot command.

[click here for bot help](https://github.com/ansible/ansibullbot/blob/master/ISSUE_HELP.md)

**Comment by jwoogee** [comment]
I tested netconf with a bastion as late as version 2.5.4 and it didn't work.  using network_cli instead of netconf does work every time.  What I've found in documentation says this should work starting with 2.5 but I haven't found that to be the case.

**Comment by gundalow** [comment]
Proposed fix in https://github.com/ansible/ansible/pull/42271

**Comment by ganeshrn** [comment]
@jwoogee Please enable `ANSIBLE_NETCONF_SSH_CONFIG` enviornment variable
```
$export ANSIBLE_NETCONF_SSH_CONFIG=1
```

And add the bastion/jump host ssh settings in ~/.ssh/config file. Please refer the troubleshooting doc update in referenced PR #42271

**Comment by pffs** [comment]
Can confirm that this works under 2.6.1.

@ganeshrn Is there any chance of being able to move this into group/host vars like the network_cli bastion options? I sometimes need to be able to run from more than one bastion in a single play and it would be nice to not need to maintain an ssh config file to separate out which hosts go to which bastion. The proposed change of being able to reference a specific config file helps, but is still less than ideal.

**Comment by ganeshrn** [comment]
@pffs Currently it is not possible and might require some major changes in the underlying handling netconf connection. 

Please raise a feature request  for this so that it can be tackled in future releases.

**Comment by abshaheen** [comment]
Can anyone confirm if this is working? i tried settings in ~/.ssh/config file along with the variable but it is not working as well.

**Comment by sliddjur** [comment]
> Can anyone confirm if this is working? i tried settings in ~/.ssh/config file along with the variable but it is not working as well.

@abshaheen its working for me. did you export variable? can you verify with `ansible-config dump`

**Comment by moolinet** [comment]
Hello,

Our setup: 
system: Ubuntu 18.04 LTS
ansible 2.6.5
python-ncclient  0.6.0-1

We spent a whole day trying to get this working until we found this bug report.
It's now working although with the following caveats:

inventory file:
`[juniper:vars]`
`ansible_network_os=junos`
`ansible_connection=netconf`

Does not work:
`#ansible.cfg`
`[netconf_connection]`
`ssh_config = 1`

Fixed with:
`export ANSIBLE_NETCONF_SSH_CONFIG=1`

This setting is not documented in the Ansible doc!  (looking for netconf or junos)

Does not work:
`#.ssh/config:`
`ProxyJump <bastion>`
Fixed with:
`ProxyCommand ssh -W %h:%p -q <bastion>`

Also we like to rewrite hostnames within the inventory file like this before calling the proxyjump in ssh config:
`ansible_ssh_common_args= '-o Hostname="%h-mgmt"'`

But this doesn't work in conjunction with junos netconf connections
as either the junos module or the ncclient library doesn't take in account ssh_common_args.

Can this be fixed/improved?
- support Proxyjump ssh config option
- support ssh_common_args defined in ansible files


Thanks

**Comment by abshaheen** [comment]
> > Can anyone confirm if this is working? i tried settings in ~/.ssh/config file along with the variable but it is not working as well.
> 
> @abshaheen its working for me. did you export variable? can you verify with `ansible-config dump`

@sliddjur thanks for your reply, yes i did and now it works fine with me.
